{
  "phase": "video-root-cycling",
  "status": "complete",
  "summary": "demo-root-cycling.mp4 (1440x900 h264 39.30s, 6 beat clips / 9 scene segments, Kokoro af_heart 0.9) produced end-to-end via the piano-demo-video pipeline, then fixed twice. Fix-up 1: the closing script line had no scene mapping (5 caption chunks scene:null, segments ended at 31.29s leaving a captions-only near-black span) \u2014 scenes re-mapped to all 9 lines, config regenerated (dbd9a870\u2026), beat6 re-cut from fresh 14s-settle tracking footage. Fix-up 2: beat6 re-cut to start on the stable seeded panel (take9 10.8-23.8, 13.0s) so both beat6-hosted segments open on 'IDEAS / Chord - m7 / 40 attempts recorded / Local practice mode' instead of the signed-out/empty tracking states. Final render published to both spots, committed and pushed with provenance trailers.",
  "files_changed": [
    "/home/justin/piano-suite/.paseo-delegate/capture-root-cycling.mjs (new, force-added like prior phases, committed with Phase/Agent-Id/Session-Id trailers)",
    "/home/justin/piano-suite/public/demo-root-cycling.mp4 (new, committed)",
    "/home/justin/piano-content/out/demo-root-cycling.mp4 (render)",
    "/home/justin/piano-content/dist/demo-root-cycling.mp4 (publish spot 1)",
    "/home/justin/piano-content/script-root-cycling.txt (new, 9 lines, one idea per beat)",
    "/home/justin/piano-content/scenes-root-cycling.json (new, 9 scene mappings over 6 beat clips)",
    "/home/justin/piano-content/public/footage-root-cycling/ (6 page captures + beat1..beat6 clips)",
    "/home/justin/piano-content/public/audio/voice.mp3 (regenerated shared slot)",
    "/home/justin/piano-content/src/config.generated.ts (regenerated shared slot, md5 recorded)"
  ],
  "verification": "ffprobe: h264 1440x900 39.300000s, 5444520 bytes. Config md5 rendered against 6370763452057159a6087b9df5d8f356; re-verified immediately before render and unchanged after; pre-regen slot snapshot /tmp/opencode/cfg-slot-pre-regen-rootcycling.ts md5 504d222002d8903bbccf2c64860777a0 (matched the arpeggios-phase slot), post-gen snapshot /tmp/opencode/cfg-rc-after-gen.ts md5 6370763452057159a6087b9df5d8f356; sceneSegments=8 counted after regeneration. Segment fit (need = segment span, clip duration, headroom >= 2s): beat1 7.74/10.52/2.78, beat2 3.87/9.52/5.65, beat3 7.10/14.52/7.42, beat4 3.87/21.32/17.45, beat5 4.20/10.52/6.32, beat6 4.51/7.00/2.49. Segment midpoints OCR (UI text AND caption): seg1@3.87 caption 'PICK ONE CHORD QUALITY' (title card); seg2@9.68 caption 'ASKS FOR THAT CHORD', UI 'Root Cycling / Drill one fixed chord or arpeggio idea across random roots in all 12 keys / Practice setup'; seg3@15.16 caption 'TO ANOTHER ROOT. THAT', UI 'Root Cycling / Practice setup'; seg4@20.65 caption 'MODE AND CYCLE THE', UI 'Root Cycling / Practice setup' (beat shows 'play the root + 5th to begin', 'LH pedal (hold)', 'next (9)'/'next (b3)', target notes A/A#, cell strip 9|b3|11|5|b7|9|11 in its window); seg5@24.68 caption 'THE KEYS YOU WANT', UI 'Root Cycling / Practice setup' (beat shows customize grid C Db D Eb E F# G Ab A Bb + 'Reset to all 12' in its window); seg6@29.04 caption 'OVER WEEKS YOU CAN', UI 'Tracking / Local practice mode / Root Cycling tab / IDEAS / Chord - m7 / 40 attempts recorded / Chord: m7 40: 1.40s' plus chart axis 40s/30s/20s/10s and 'Roots practiced: G (x40)'. Freeze check: fps=1 scale=32:18 YDIF per segment window, longest zero-run = 1 sample on every segment (no frozen beats); YAVG min 12.73 / max 253.97 (no blank frames); end card 37.5s OCR 'Piano Suite / Free practice tools for self-taught pianists'. Publish: md5 0ab9b66a98751ab35641283fdcf9d6c2 identical across out/dist/public; http://127.0.0.1:8454/demo-root-cycling.mp4 -> 200. git: commit 0ae2c2f pushed to origin main; tree clean beyond pre-existing baseline (docs/quick-fixes-2026-09/, public/demo-web.mp4). | FIXUP-2: beat6 re-cut from take9 10.8-23.8 (13.0s >= 10.001+2.0); config slot untouched \u2014 pre-render /tmp/opencode/cfg-slot-pre-fixup2-rootcycling.ts and post-render /tmp/opencode/cfg-slot-post-fixup2-rootcycling.ts both md5 dbd9a870e61b76cb45ef13ea2e2df5e0. beat6 OCR at segment-local +0.5/+1.5/+2.5/+4.0: 'Local practice mode \u2014 upgrade to Pro\u2026' banner + 'IDEAS 40 attempts recorded attempt \u2116 (chronological) \u2014 40 total' at every sample, zero 'Sign in to view'/'No first-chord attempts'. Render sweep fps=1 over seg8 (26.777-31.294) + seg9 (31.294-36.779): 11 samples, bad=0, panel-visible=11. New render ffprobe h264 1440x900 39.300000s; all 9 midpoints re-verified (captions + UI: Practice setup, nice \u2014 skip to the next root, LH pedal (hold), Root Pool/Db/Reset, IDEAS/40 attempts recorded); YDIF longest zero-run=1 on all 9 segments; end card 'Piano Suite'. Publish md5 f25117d17214850cdef8759842f4af04 identical across out/dist/public; :8454 -> 200.",
  "blockers": [],
  "tooling_notes": "First capture run had two defects, both caught by OCR and fixed before beat cutting: (1) the arpeggio beat parsed the prompt symbol 'E + B' as the root name and played the wrong LH pedal, leaving the drill stuck in awaiting-root \u2014 re-shot with root parsed from the first token plus a Root-tile cross-check; (2) the tracking beat's midpoint fell on the Chord Drill empty-state tab because the tab click lands ~3.4s into the take \u2014 beat6 recut from take6 9-16s so the Root Cycling panel owns its midpoint. Stat-tile digits ('Roots completed' counter) resist OCR at the success-card scroll position; success states were verified via the 'nice \u2014 skip to the next root' badge, Next-root button, and per-root prompt symbols (Abm7, Dm7, Bm7) instead. The prior phase's pkill note was heeded: cleanup used a port-scoped kill only. Dev server on :3002 was started inside this session and stopped after capture.",
  "handoff_notes": "Chain protocol unchanged for video-progression: own dev-server port >=3002 (:3000 is the opencode proxy, :3001 dead), snapshot config.generated.ts with md5 before regenerating, regenerate IMMEDIATELY before render, count sceneSegments after every regen, re-verify md5 pre-render, --concurrency=2, >=2s segment-fit headroom, tesseract psm 11 + band crops only. New footprints: footage dir footage-root-cycling, script/scenes named *-root-cycling. The Root Cycling drill reads settings from Convex cloud (mode/quality/root pool) \u2014 configure through the UI testids, never by seeding; history seeding key is blocked-drill-rootcycle-log with shape {mode,label,root,quality,ms,ts}. Progression phase note: the progression drill (ii-V-I / 12-bar blues) logs to piano-suite-progression-log-v1 and has its own Tracking tab (tracking-tab-progression does not exist \u2014 the tab id is 'progression'? verify in app/tools/tracking/page.tsx; tabs are chords|arpeggios|rootcycle|workshop, and Progression logs may surface under a different panel)."
}